{
  "icnp_version": "1.0.0",
  "type": "contract_proposal",
  "phase": "contract",
  "message_id": "a396b5ce-6828-4aea-aa4d-99d4a69d6ebc",
  "session_id": "4c0fba9b-77a9-4917-bf95-ff09f3bf8dd9",
  "timestamp": "2026-01-09T13:05:22Z",
  "sender": {
    "id": "agent-orchestrator",
    "role": "orchestrator",
    "display_name": "Orchestrator"
  },
  "payload": {
    "contract": {
      "contract_id": "83d699de-c166-4007-a03d-0e0ca08481fc",
      "session_id": "4c0fba9b-77a9-4917-bf95-ff09f3bf8dd9",
      "issued_at": "2026-01-09T13:05:22Z",
      "parties": [
        {
          "id": "agent-orchestrator",
          "role": "orchestrator",
          "display_name": "Orchestrator"
        },
        {
          "id": "agent-planner",
          "role": "agent",
          "display_name": "Planner"
        },
        {
          "id": "agent-writer",
          "role": "agent",
          "display_name": "Writer"
        },
        {
          "id": "agent-reviewer",
          "role": "agent",
          "display_name": "Reviewer"
        },
        {
          "id": "agent-summariser",
          "role": "agent",
          "display_name": "Summariser"
        }
      ],
      "agreed_actions": [
        {
          "action_id": "cc122b7f-2d90-491a-b400-3c9b4be89392",
          "capability_id": "67058c02-038e-4022-8856-f8a36585c8f9",
          "executor_id": "agent-planner",
          "action": "compose_outline",
          "scope": "text",
          "max_invocations": 1
        },
        {
          "action_id": "ab0959e5-452b-4abd-aec2-70499b04c6c0",
          "capability_id": "d5256a20-cc07-46e7-a9fd-c0c9174b4e15",
          "executor_id": "agent-writer",
          "action": "write_draft",
          "scope": "text",
          "max_invocations": 1
        },
        {
          "action_id": "92786235-1fac-48de-b3a5-ad7810733146",
          "capability_id": "78d153e2-ea1e-4cdc-b0b8-58c964a983f8",
          "executor_id": "agent-reviewer",
          "action": "review_text",
          "scope": "text",
          "max_invocations": 1
        },
        {
          "action_id": "bef51b1a-0b5e-4b06-aa2b-234d22dfaec5",
          "capability_id": "e13c0534-d34c-46da-ba31-5fff839a8aa2",
          "executor_id": "agent-summariser",
          "action": "summarise_text",
          "scope": "text",
          "max_invocations": 1
        }
      ],
      "forbidden_actions": [
        {
          "action": "network_access",
          "reason": "No external side-effects allowed"
        }
      ],
      "constraints": {
        "risk_tolerance": "low"
      },
      "enforcement": {
        "mode": "strict",
        "violation_action": "abort",
        "audit_level": "standard",
        "logging_required": true,
        "rollback_required": false
      },
      "approvals": [],
      "signatures": []
    }
  }
}
