[
  {
    "icnp_version": "1.0.0",
    "type": "capability_disclosure",
    "phase": "capability",
    "message_id": "dfad98a1-5919-4eb7-ae4f-779dc5d18f2a",
    "session_id": "4c0fba9b-77a9-4917-bf95-ff09f3bf8dd9",
    "timestamp": "2026-01-09T13:05:22Z",
    "sender": {
      "id": "agent-planner",
      "role": "agent",
      "display_name": "Planner"
    },
    "recipient": {
      "id": "agent-orchestrator",
      "role": "orchestrator",
      "display_name": "Orchestrator"
    },
    "in_reply_to": "15e5661a-455b-47c1-8a35-9a6152755116",
    "payload": {
      "capabilities": [
        {
          "capability_id": "67058c02-038e-4022-8856-f8a36585c8f9",
          "name": "Planner capability",
          "description": "Planner can perform its specialised text task.",
          "actions": [
            {
              "action": "compose_outline",
              "scopes": [
                "text"
              ],
              "requires_approval": false,
              "confidence": 0.85,
              "effects": "none"
            }
          ]
        }
      ]
    }
  },
  {
    "icnp_version": "1.0.0",
    "type": "capability_disclosure",
    "phase": "capability",
    "message_id": "a2ab1630-c085-4e35-86d6-fd6c2e07ce1c",
    "session_id": "4c0fba9b-77a9-4917-bf95-ff09f3bf8dd9",
    "timestamp": "2026-01-09T13:05:22Z",
    "sender": {
      "id": "agent-writer",
      "role": "agent",
      "display_name": "Writer"
    },
    "recipient": {
      "id": "agent-orchestrator",
      "role": "orchestrator",
      "display_name": "Orchestrator"
    },
    "in_reply_to": "15e5661a-455b-47c1-8a35-9a6152755116",
    "payload": {
      "capabilities": [
        {
          "capability_id": "d5256a20-cc07-46e7-a9fd-c0c9174b4e15",
          "name": "Writer capability",
          "description": "Writer can perform its specialised text task.",
          "actions": [
            {
              "action": "write_draft",
              "scopes": [
                "text"
              ],
              "requires_approval": false,
              "confidence": 0.8,
              "effects": "none"
            }
          ]
        }
      ]
    }
  },
  {
    "icnp_version": "1.0.0",
    "type": "capability_disclosure",
    "phase": "capability",
    "message_id": "46bdb0bd-2202-4a5c-b9da-b670f44dd811",
    "session_id": "4c0fba9b-77a9-4917-bf95-ff09f3bf8dd9",
    "timestamp": "2026-01-09T13:05:22Z",
    "sender": {
      "id": "agent-reviewer",
      "role": "agent",
      "display_name": "Reviewer"
    },
    "recipient": {
      "id": "agent-orchestrator",
      "role": "orchestrator",
      "display_name": "Orchestrator"
    },
    "in_reply_to": "15e5661a-455b-47c1-8a35-9a6152755116",
    "payload": {
      "capabilities": [
        {
          "capability_id": "78d153e2-ea1e-4cdc-b0b8-58c964a983f8",
          "name": "Reviewer capability",
          "description": "Reviewer can perform its specialised text task.",
          "actions": [
            {
              "action": "review_text",
              "scopes": [
                "text"
              ],
              "requires_approval": false,
              "confidence": 0.75,
              "effects": "none"
            }
          ]
        }
      ]
    }
  },
  {
    "icnp_version": "1.0.0",
    "type": "capability_disclosure",
    "phase": "capability",
    "message_id": "cb2bb9a7-ec23-46c9-86da-cddef4440bd8",
    "session_id": "4c0fba9b-77a9-4917-bf95-ff09f3bf8dd9",
    "timestamp": "2026-01-09T13:05:22Z",
    "sender": {
      "id": "agent-summariser",
      "role": "agent",
      "display_name": "Summariser"
    },
    "recipient": {
      "id": "agent-orchestrator",
      "role": "orchestrator",
      "display_name": "Orchestrator"
    },
    "in_reply_to": "15e5661a-455b-47c1-8a35-9a6152755116",
    "payload": {
      "capabilities": [
        {
          "capability_id": "e13c0534-d34c-46da-ba31-5fff839a8aa2",
          "name": "Summariser capability",
          "description": "Summariser can perform its specialised text task.",
          "actions": [
            {
              "action": "summarise_text",
              "scopes": [
                "text"
              ],
              "requires_approval": false,
              "confidence": 0.8,
              "effects": "none"
            }
          ]
        }
      ]
    }
  }
]
